{
  "contract_version": "creative-viral-remake-workspace/v1",
  "task_id": "creativetask_viral_rights_blocked",
  "revision": 1,
  "status": "rights_blocked",
  "selected_route_id": "route_manual_viral_remake_v1",
  "readiness": {
    "planning_ready": true,
    "generation_ready": false,
    "production_ready": false
  },
  "blockers": ["reference_video_rights"],
  "recoverable": true
}
